topic,los,exam_year,tags,difficulty,stem,option_a,option_b,option_c,answer,explanation
Quantitative Methods,Reading 1,2026,quantitative-methods|practice-pack,Easy,A stock price moves from $100 to $115 with no dividends. The holding period return is closest to:,13%,15%,18%,B,HPR = (P1 - P0) / P0 = 15%.
Quantitative Methods,Reading 1,2026,quantitative-methods|practice-pack,Medium,A stock price moves from $50 to $44 with no dividends. The holding period return is closest to:,-14%,-12%,-9%,B,HPR = (P1 - P0) / P0 = -12%.
Quantitative Methods,Reading 1,2026,quantitative-methods|practice-pack,Easy,A stock price moves from $200 to $230 with no dividends. The holding period return is closest to:,13%,15%,18%,B,HPR = (P1 - P0) / P0 = 15%.
Quantitative Methods,Reading 1,2026,quantitative-methods|practice-pack,Medium,A stock price moves from $80 to $92 with no dividends. The holding period return is closest to:,13%,15%,18%,B,HPR = (P1 - P0) / P0 = 15%.
Quantitative Methods,Reading 1,2026,quantitative-methods|practice-pack,Easy,A stock price moves from $120 to $108 with no dividends. The holding period return is closest to:,-12%,-10%,-7%,B,HPR = (P1 - P0) / P0 = -10%.
Quantitative Methods,Reading 1,2026,quantitative-methods|practice-pack,Medium,A stock price moves from $250 to $275 with no dividends. The holding period return is closest to:,8%,10%,13%,B,HPR = (P1 - P0) / P0 = 10%.
Quantitative Methods,Reading 1,2026,quantitative-methods|practice-pack,Easy,A stock price moves from $90 to $99 with no dividends. The holding period return is closest to:,8%,10%,13%,B,HPR = (P1 - P0) / P0 = 10%.
Quantitative Methods,Reading 1,2026,quantitative-methods|practice-pack,Medium,A stock price moves from $300 to $345 with no dividends. The holding period return is closest to:,13%,15%,18%,B,HPR = (P1 - P0) / P0 = 15%.
Quantitative Methods,Reading 2,2026,quantitative-methods|practice-pack,Easy,"An investment of $1,000 grows to $1,158 in 3 years with annual compounding. The annual rate of return is closest to:",4%,5%,7%,B,"Using FV = PV × (1 + r)^n, the implied rate is approximately 5%."
Quantitative Methods,Reading 2,2026,quantitative-methods|practice-pack,Medium,"An investment of $2,000 grows to $2,525 in 4 years with annual compounding. The annual rate of return is closest to:",5%,6%,8%,B,"Using FV = PV × (1 + r)^n, the implied rate is approximately 6%."
Quantitative Methods,Reading 2,2026,quantitative-methods|practice-pack,Medium,An investment of $500 grows to $583 in 2 years with annual compounding. The annual rate of return is closest to:,7%,8%,10%,B,"Using FV = PV × (1 + r)^n, the implied rate is approximately 8%."
Quantitative Methods,Reading 2,2026,quantitative-methods|practice-pack,Easy,"An investment of $1,500 grows to $1,825 in 5 years with annual compounding. The annual rate of return is closest to:",3%,4%,6%,B,"Using FV = PV × (1 + r)^n, the implied rate is approximately 4%."
Quantitative Methods,Reading 2,2026,quantitative-methods|practice-pack,Medium,"An investment of $800 grows to $1,065 in 3 years with annual compounding. The annual rate of return is closest to:",9%,10%,12%,B,"Using FV = PV × (1 + r)^n, the implied rate is approximately 10%."
Quantitative Methods,Reading 2,2026,quantitative-methods|practice-pack,Medium,"An investment of $2,500 grows to $3,752 in 6 years with annual compounding. The annual rate of return is closest to:",6%,7%,9%,B,"Using FV = PV × (1 + r)^n, the implied rate is approximately 7%."
Quantitative Methods,Reading 2,2026,quantitative-methods|practice-pack,Easy,"An investment of $1,200 grows to $1,426 in 2 years with annual compounding. The annual rate of return is closest to:",8%,9%,11%,B,"Using FV = PV × (1 + r)^n, the implied rate is approximately 9%."
Quantitative Methods,Reading 2,2026,quantitative-methods|practice-pack,Medium,"An investment of $3,000 grows to $3,647 in 4 years with annual compounding. The annual rate of return is closest to:",4%,5%,7%,B,"Using FV = PV × (1 + r)^n, the implied rate is approximately 5%."
Quantitative Methods,Reading 2,2026,quantitative-methods|practice-pack,Medium,"An investment of $750 grows to $1,054 in 3 years with annual compounding. The annual rate of return is closest to:",11%,12%,14%,B,"Using FV = PV × (1 + r)^n, the implied rate is approximately 12%."
Quantitative Methods,Reading 2,2026,quantitative-methods|practice-pack,Easy,"An investment of $1,800 grows to $2,409 in 5 years with annual compounding. The annual rate of return is closest to:",5%,6%,8%,B,"Using FV = PV × (1 + r)^n, the implied rate is approximately 6%."
Quantitative Methods,Reading 3,2026,quantitative-methods|practice-pack,Medium,Which measure of central tendency is most appropriate when a return series contains a few extreme outliers?,Arithmetic mean,Median,Geometric mean,B,The median is less sensitive to outliers than the mean or geometric mean.
Quantitative Methods,Reading 3,2026,quantitative-methods|practice-pack,Medium,"For a sample of returns, the coefficient of variation is defined as:",Standard deviation divided by the mean,Mean divided by standard deviation,Variance divided by the mean,A,CV = s / x̄ and measures risk per unit of return.
Quantitative Methods,Reading 3,2026,quantitative-methods|practice-pack,Hard,"If a distribution is negatively skewed, the relationship among mean, median, and mode is most likely:",Mean < median < mode,Mean > median > mode,Mean = median = mode,A,Negative skew pulls the mean below the median.
Quantitative Methods,Reading 3,2026,quantitative-methods|practice-pack,Hard,"The geometric mean of 10%, 20%, and -5% is closest to:",8.0%,8.3%,8.6%,B,Geometric mean compounds multi-period returns: [(1.10)(1.20)(0.95)]^(1/3) - 1 ≈ 8.3%.
Quantitative Methods,Reading 3,2026,quantitative-methods|practice-pack,Easy,Which statistic is most appropriate for measuring the dispersion of returns around the mean?,Range,Standard deviation,Mode,B,Standard deviation captures average deviation from the mean.
Quantitative Methods,Reading 3,2026,quantitative-methods|practice-pack,Medium,A leptokurtic return distribution most likely has:,Fatter tails and a higher peak than a normal distribution,Thinner tails and a lower peak than a normal distribution,Zero skewness by definition,A,Leptokurtosis implies excess kurtosis relative to the normal distribution.
Quantitative Methods,Reading 3,2026,quantitative-methods|practice-pack,Medium,The arithmetic mean return is generally greater than the geometric mean return when:,Returns are constant over time,Returns vary over time,All returns are negative,B,Variability creates a positive gap between arithmetic and geometric means.
Quantitative Methods,Reading 3,2026,quantitative-methods|practice-pack,Easy,"For a positively skewed distribution, which statement is most accurate?",The mean is greater than the median,The mean is less than the median,The median equals the mode,A,Positive skew pulls the mean above the median.
Quantitative Methods,Reading 4,2026,quantitative-methods|practice-pack,Easy,"If P(A) = 0.40 and P(B) = 0.50, and A and B are independent, P(A and B) is closest to:",0.20,0.45,0.90,A,"For independent events, P(A ∩ B) = P(A) × P(B) = 0.20."
Quantitative Methods,Reading 4,2026,quantitative-methods|practice-pack,Medium,An analyst estimates a 60% probability of an up market and a 70% chance a stock beats the benchmark given an up market. The joint probability is closest to:,0.18,0.42,0.70,B,Joint probability = 0.60 × 0.70 = 0.42.
Quantitative Methods,Reading 4,2026,quantitative-methods|practice-pack,Hard,"Using Bayes’ formula, if P(H) = 0.30, P(E|H) = 0.80, and P(E|not H) = 0.20, then P(H|E) is closest to:",0.46,0.63,0.80,B,Posterior probability updates the prior using new evidence.
Quantitative Methods,Reading 4,2026,quantitative-methods|practice-pack,Easy,The expected value of a discrete random variable is calculated as:,The sum of all possible outcomes,The probability-weighted average of outcomes,The most likely outcome,B,Expected value equals Σ [P(xi) × xi].
Quantitative Methods,Reading 4,2026,quantitative-methods|practice-pack,Easy,"If two events are mutually exclusive, which statement is most accurate?",P(A and B) = P(A) × P(B),P(A or B) = P(A) + P(B),P(A or B) = P(A) × P(B),B,"Mutually exclusive events cannot occur together, so joint probability is zero."
Quantitative Methods,Reading 4,2026,quantitative-methods|practice-pack,Medium,A portfolio has a 25% chance of a 12% return and a 75% chance of a 4% return. The expected return is closest to:,4%,6%,8%,B,E(R) = 0.25(12%) + 0.75(4%) = 6%.
Quantitative Methods,Reading 4,2026,quantitative-methods|practice-pack,Medium,Which distribution is most appropriate for modeling the number of defaults in a fixed-size loan pool over a period?,Normal distribution,Binomial distribution,Lognormal distribution,B,A binomial model counts successes/failures in a fixed number of trials.
Quantitative Methods,Reading 4,2026,quantitative-methods|practice-pack,Easy,"A continuous uniform distribution on the interval [2, 6] has a mean of:",2,4,6,B,"For a uniform distribution, the mean is (a + b) / 2 = 4."
Quantitative Methods,Reading 5,2026,quantitative-methods|practice-pack,Easy,"For a normally distributed variable, approximately what percentage of observations lie within one standard deviation of the mean?",50%,68%,95%,B,The 68-95-99.7 rule applies to normal distributions.
Quantitative Methods,Reading 5,2026,quantitative-methods|practice-pack,Medium,The lognormal distribution is most appropriate for modeling:,Portfolio returns over one period,Asset prices that cannot be negative,Sample means from large samples,B,Prices are bounded below by zero and often modeled as lognormal.
Quantitative Methods,Reading 5,2026,quantitative-methods|practice-pack,Medium,"According to the central limit theorem, the sampling distribution of the sample mean approaches normality as sample size increases, regardless of the population distribution, when:",The population variance is zero,The sample size is sufficiently large,The population is normal only,B,CLT requires a sufficiently large sample size.
Quantitative Methods,Reading 5,2026,quantitative-methods|practice-pack,Easy,Which pair of portfolio statistics determines the entire normal distribution of portfolio returns?,Mean and variance,Mean and skewness,Median and range,A,A normal distribution is fully defined by its mean and variance.
Quantitative Methods,Reading 5,2026,quantitative-methods|practice-pack,Hard,Roy’s safety-first criterion selects the portfolio with the highest:,Expected return only,Probability that return exceeds a minimum acceptable return,Sharpe ratio only,B,Safety-first maximizes P(R > RL).
Quantitative Methods,Reading 5,2026,quantitative-methods|practice-pack,Medium,Shortfall risk is best defined as the probability that:,Return equals the expected return,Return falls below a specified minimum level,Return exceeds the benchmark,B,Shortfall risk focuses on failing to meet a threshold return.
Quantitative Methods,Reading 6,2026,quantitative-methods|practice-pack,Medium,Monte Carlo simulation is most useful when:,Analytical solutions are easy and exact,Multiple correlated inputs and path dependency make closed-form solutions difficult,Only one deterministic outcome exists,B,"Simulation handles complex, path-dependent problems without closed-form solutions."
Quantitative Methods,Reading 6,2026,quantitative-methods|practice-pack,Medium,A limitation of Monte Carlo simulation is that results:,Cannot incorporate correlation among variables,Depend on the assumptions and input distributions chosen,Always understate tail risk,B,Output quality depends on model assumptions and inputs.
Quantitative Methods,Reading 6,2026,quantitative-methods|practice-pack,Hard,"In a bootstrap resampling method, the analyst repeatedly:",Generates new data from a theoretical distribution only,Draws samples with replacement from the observed sample,Removes outliers before each draw,B,Bootstrap resampling draws with replacement from observed data.
Quantitative Methods,Reading 6,2026,quantitative-methods|practice-pack,Easy,Historical simulation differs from Monte Carlo simulation because historical simulation:,Uses randomly generated inputs from assumed distributions,Replays actual historical scenarios,Requires normality of returns,B,Historical simulation uses actual past outcomes rather than simulated ones.
Quantitative Methods,Reading 7,2026,quantitative-methods|practice-pack,Easy,The standard error of the sample mean decreases when:,Sample size increases,Population variance increases,Sample size decreases,A,"Standard error = σ / √n, so it falls as n rises."
Quantitative Methods,Reading 7,2026,quantitative-methods|practice-pack,Medium,A 95% confidence interval for the population mean is constructed as:,Sample mean ± 1.96 × standard error,Sample mean ± 2.58 × sample standard deviation,Sample mean ± 0.95 × standard error,A,"For large samples, 95% CI uses the 1.96 critical value."
Quantitative Methods,Reading 7,2026,quantitative-methods|practice-pack,Medium,Which statement about the t-distribution is most accurate?,It has fatter tails than the normal distribution when degrees of freedom are small,It is identical to the normal distribution for all sample sizes,It applies only to variance estimation,A,The t-distribution approaches normality as degrees of freedom increase.
Quantitative Methods,Reading 7,2026,quantitative-methods|practice-pack,Medium,"If sample size is 25 and population variance is unknown, the appropriate distribution for inference about the mean is the:",Normal distribution,t-distribution with 24 degrees of freedom,Chi-square distribution,B,Use the t-distribution when σ is unknown and n is small.
Quantitative Methods,Reading 7,2026,quantitative-methods|practice-pack,Easy,An unbiased estimator is one for which:,The expected value of the estimator equals the population parameter,The sample statistic always equals the parameter,The estimator has zero variance,A,Unbiasedness means E(estimator) = parameter.
Quantitative Methods,Reading 7,2026,quantitative-methods|practice-pack,Easy,Increasing sample size from 50 to 200 will most likely:,Widen the confidence interval,Narrow the confidence interval,Leave the confidence interval unchanged,B,Larger n reduces standard error and narrows the interval.
Quantitative Methods,Reading 7,2026,quantitative-methods|practice-pack,Easy,The point estimate of the population mean is:,The sample mean,The sample median,The population standard deviation,A,The sample mean is the usual point estimate of μ.
Quantitative Methods,Reading 7,2026,quantitative-methods|practice-pack,Medium,"When constructing a confidence interval, a higher confidence level will most likely:",Narrow the interval,Widen the interval,Leave the interval unchanged,B,Higher confidence requires a wider interval to capture the parameter.
Quantitative Methods,Reading 8,2026,quantitative-methods|practice-pack,Easy,"In hypothesis testing, a Type I error occurs when:",The null hypothesis is true but is rejected,The null hypothesis is false but is not rejected,The alternative hypothesis is true and is accepted,A,Type I error is a false positive rejection of a true null.
Quantitative Methods,Reading 8,2026,quantitative-methods|practice-pack,Medium,The p-value of a test is best interpreted as the probability of:,The null hypothesis being true,"Obtaining a test statistic at least as extreme as observed, assuming H0 is true",The alternative hypothesis being false,B,The p-value measures evidence against H0 under the assumption H0 is true.
Quantitative Methods,Reading 8,2026,quantitative-methods|practice-pack,Medium,"If a test rejects H0 at the 5% significance level, which statement is most accurate?",There is a 5% chance H0 is true,The result is statistically significant at the 5% level,The economic significance is guaranteed,B,"Rejecting at 5% means the result is significant at that level, not that H0 is true with 5% probability."
Quantitative Methods,Reading 8,2026,quantitative-methods|practice-pack,Easy,A Type II error occurs when:,A false null is rejected,A false null is not rejected,A true null is rejected,B,Type II error is failing to reject a false null.
Quantitative Methods,Reading 8,2026,quantitative-methods|practice-pack,Medium,The power of a hypothesis test is defined as:,The probability of rejecting a false null hypothesis,The probability of rejecting a true null hypothesis,The significance level of the test,A,Power = 1 - P(Type II error).
Quantitative Methods,Reading 8,2026,quantitative-methods|practice-pack,Easy,"For a two-tailed z-test at the 5% level, the critical values are approximately:",±1.645,±1.96,±2.58,B,A 5% two-tailed test uses ±1.96.
Quantitative Methods,Reading 8,2026,quantitative-methods|practice-pack,Medium,Which test is most appropriate for comparing means of two independent samples with unknown but equal variances?,Paired t-test,Two-sample pooled t-test,Chi-square test,B,The pooled t-test applies to independent samples with equal variances.
Quantitative Methods,Reading 8,2026,quantitative-methods|practice-pack,Medium,A paired comparisons t-test is most appropriate when:,Two independent samples are drawn from different populations,Observations are naturally matched or measured twice on the same subjects,Population variance is known,B,Paired tests use differences between matched observations.
Quantitative Methods,Reading 8,2026,quantitative-methods|practice-pack,Easy,"If the calculated test statistic falls in the rejection region, the analyst should:",Reject the null hypothesis,Fail to reject the null hypothesis,Accept the null hypothesis as true,A,Values in the rejection region lead to rejection of H0.
Quantitative Methods,Reading 8,2026,quantitative-methods|practice-pack,Medium,Increasing the significance level from 1% to 5% will most likely:,Decrease the probability of Type I error,Increase the probability of Type I error,Leave Type I error unchanged,B,A higher α increases the chance of rejecting a true null.
Quantitative Methods,Reading 9,2026,quantitative-methods|practice-pack,Medium,The Mann-Whitney U test is most appropriate when:,Two independent samples are normally distributed,Two independent samples are not normally distributed,Observations are paired and normal,B,Mann-Whitney is a non-parametric test for independent samples.
Quantitative Methods,Reading 9,2026,quantitative-methods|practice-pack,Medium,The chi-square test for independence is used to assess whether:,Two population means are equal,Two categorical variables are related,Sample variance equals population variance,B,Chi-square independence tests association between categorical variables.
Quantitative Methods,Reading 9,2026,quantitative-methods|practice-pack,Easy,A non-parametric test is most useful when:,Normality and homoscedasticity assumptions are questionable,Sample size is extremely large and data are normal,Population variance is known,A,Non-parametric tests relax distributional assumptions.
Quantitative Methods,Reading 9,2026,quantitative-methods|practice-pack,Medium,The Spearman rank correlation measures:,Linear relationship only,Monotonic relationship based on ranks,Causal relationship between variables,B,Spearman correlation assesses monotonic association using ranks.
Quantitative Methods,Reading 9,2026,quantitative-methods|practice-pack,Medium,Which test compares observed frequencies to expected frequencies under a specified distribution?,t-test,Chi-square goodness-of-fit test,F-test,B,Goodness-of-fit chi-square compares observed and expected counts.
Quantitative Methods,Reading 9,2026,quantitative-methods|practice-pack,Hard,The Wilcoxon signed-rank test is most similar in purpose to:,A paired t-test,An F-test for variance,A chi-square test of independence,A,Wilcoxon signed-rank is the non-parametric counterpart to the paired t-test.
Quantitative Methods,Reading 9,2026,quantitative-methods|practice-pack,Easy,A parametric test generally requires stronger assumptions about:,The underlying population distribution,The measurement scale only,The sample collection method only,A,"Parametric tests assume a specific distribution, often normality."
Quantitative Methods,Reading 9,2026,quantitative-methods|practice-pack,Hard,"When comparing more than two group means with non-normal data, an analyst may use:",Kruskal-Wallis test,Simple linear regression,Durbin-Watson test,A,Kruskal-Wallis extends rank-based testing to multiple groups.
Quantitative Methods,Reading 10,2026,quantitative-methods|practice-pack,Easy,"In simple linear regression, the slope coefficient indicates:",The expected change in Y for a one-unit change in X,The correlation between X and Y only,The proportion of variance explained by the model,A,The slope measures the marginal effect of X on Y.
Quantitative Methods,Reading 10,2026,quantitative-methods|practice-pack,Easy,The coefficient of determination (R²) represents:,The proportion of total variation in Y explained by X,The standard error of the estimate,The slope of the regression line,A,R² measures explanatory power of the independent variable.
Quantitative Methods,Reading 10,2026,quantitative-methods|practice-pack,Medium,"If the correlation between X and Y is 0.80, R² is closest to:",0.80,0.64,0.36,B,R² equals the square of the correlation: 0.80² = 0.64.
Quantitative Methods,Reading 10,2026,quantitative-methods|practice-pack,Easy,A residual in regression analysis is defined as:,Actual Y minus predicted Y,Predicted Y minus actual Y divided by n,The slope divided by the standard error,A,Residual = observed value - fitted value.
Quantitative Methods,Reading 10,2026,quantitative-methods|practice-pack,Medium,Heteroskedasticity in a regression model means:,The error variance is not constant across observations,Independent variables are perfectly correlated,The mean of residuals is not zero,A,Heteroskedasticity violates the constant variance assumption.
Quantitative Methods,Reading 10,2026,quantitative-methods|practice-pack,Medium,The standard error of the regression estimate measures:,Average distance of observed Y values from the regression line,The slope coefficient only,The correlation between X and Y,A,It reflects typical deviation of Y from the fitted line.
Quantitative Methods,Reading 10,2026,quantitative-methods|practice-pack,Medium,"If the t-statistic for a slope coefficient exceeds the critical value, the analyst concludes the slope is:",Statistically different from zero,Economically meaningful by default,Equal to the intercept,A,A significant t-statistic indicates the slope differs from zero statistically.
Quantitative Methods,Reading 11,2026,quantitative-methods|practice-pack,Easy,Structured data is best described as data that:,Has no defined format and includes text and images only,Is organized in rows and columns with defined fields,Cannot be stored in databases,B,Structured data fits neatly into tables with defined fields.
Quantitative Methods,Reading 11,2026,quantitative-methods|practice-pack,Medium,Overfitting in machine learning occurs when a model:,Performs well on training data but poorly on new data,Uses too few variables,Has no predictive power on any dataset,A,Overfitting captures noise in the training sample.
